{
  "$schema": "http://json-schema.org/draft-07/schema#",
  "title": "screen-manifest.generated",
  "description": "design-spec-kit 还原交接层：每屏交接清单生成物的机读契约。guard⑥（check-manifest）与 T1 结构对账只认符合本 schema 的生成物。",
  "type": "object",
  "required": [
    "screen",
    "version",
    "elements",
    "states"
  ],
  "additionalProperties": false,
  "properties": {
    "screen": {
      "type": "object",
      "required": [
        "id",
        "source"
      ],
      "additionalProperties": false,
      "properties": {
        "id": {
          "type": "string",
          "pattern": "^[a-z0-9][a-z0-9-]*$"
        },
        "title": {
          "type": "string"
        },
        "source": {
          "type": "string"
        }
      }
    },
    "version": {
      "type": "integer",
      "minimum": 1
    },
    "state_classes": {
      "type": "object",
      "additionalProperties": false,
      "properties": {
        "inherit": {
          "type": "boolean"
        },
        "exempt": {
          "type": "array",
          "items": {
            "type": "object",
            "required": [
              "id",
              "note"
            ],
            "additionalProperties": false,
            "properties": {
              "id": {
                "type": "string"
              },
              "note": {
                "type": "string",
                "minLength": 4
              }
            }
          }
        }
      }
    },
    "interactions": {
      "type": "array",
      "items": {
        "$ref": "#/definitions/interaction"
      }
    },
    "elements": {
      "type": "array",
      "minItems": 1,
      "items": {
        "type": "object",
        "required": [
          "anchor",
          "role"
        ],
        "additionalProperties": false,
        "properties": {
          "anchor": {
            "type": "string",
            "pattern": "^[a-z][a-z0-9-]*$"
          },
          "role": {
            "type": "string",
            "minLength": 2
          },
          "copy_key": {
            "type": "string"
          },
          "icon": {
            "type": "string"
          },
          "states": {
            "type": "array",
            "items": {
              "type": "string"
            }
          },
          "contracts": {
            "$ref": "#/definitions/contracts"
          },
          "delegated": {
            "$ref": "#/definitions/delegation"
          }
        }
      }
    },
    "states": {
      "type": "object",
      "required": [
        "designed"
      ],
      "additionalProperties": false,
      "properties": {
        "designed": {
          "type": "array",
          "items": {
            "type": "object",
            "required": [
              "id"
            ],
            "additionalProperties": false,
            "properties": {
              "id": {
                "type": "string"
              },
              "note": {
                "type": "string"
              }
            }
          }
        },
        "delegated": {
          "type": "array",
          "items": {
            "type": "object",
            "required": [
              "state",
              "to",
              "contract_ref",
              "status"
            ],
            "additionalProperties": false,
            "properties": {
              "state": {
                "type": "string"
              },
              "to": {
                "enum": [
                  "impl",
                  "backend",
                  "firmware",
                  "other"
                ]
              },
              "contract_ref": {
                "type": "string",
                "minLength": 3
              },
              "status": {
                "enum": [
                  "open",
                  "reconciled",
                  "dropped"
                ]
              }
            }
          }
        }
      }
    },
    "params_ref": {
      "type": "object",
      "required": [
        "generator",
        "output"
      ],
      "additionalProperties": false,
      "properties": {
        "generator": {
          "type": "string"
        },
        "output": {
          "type": "string"
        }
      }
    },
    "generator": {
      "type": "string",
      "description": "manifest-sync projection 版本标记（如 schema-projection-v1）；由 tools/manifest-sync.js 写入 generated，源 manifest 不需要"
    }
  },
  "definitions": {
    "interaction": {
      "type": "object",
      "required": [
        "trigger",
        "action",
        "target"
      ],
      "additionalProperties": false,
      "properties": {
        "trigger": {
          "type": "string",
          "pattern": "^[a-z][a-z0-9-]*$"
        },
        "action": {
          "enum": [
            "opens",
            "closes",
            "toggles",
            "selects",
            "navigates"
          ]
        },
        "target": {
          "type": "string",
          "pattern": "^[a-z][a-z0-9-]*$"
        }
      }
    },
    "contracts": {
      "type": "object",
      "additionalProperties": false,
      "properties": {
        "surface": {
          "enum": [
            "dark-glass",
            "light-surface",
            "neutral-surface",
            "transparent",
            "danger-surface"
          ]
        },
        "themeInvariant": {
          "type": "boolean"
        },
        "motion": {
          "type": "object",
          "additionalProperties": false,
          "properties": {
            "portrait": {
              "enum": [
                "none",
                "fade",
                "slide-up",
                "slide-down",
                "slide-in-left",
                "slide-in-right",
                "scale"
              ]
            },
            "landscape": {
              "enum": [
                "none",
                "fade",
                "slide-up",
                "slide-down",
                "slide-in-left",
                "slide-in-right",
                "scale"
              ]
            }
          }
        }
      }
    },
    "delegation": {
      "type": "object",
      "required": [
        "to",
        "contract_ref",
        "status"
      ],
      "additionalProperties": false,
      "properties": {
        "to": {
          "enum": [
            "impl",
            "backend",
            "firmware",
            "other"
          ]
        },
        "contract_ref": {
          "type": "string",
          "minLength": 3
        },
        "status": {
          "enum": [
            "open",
            "reconciled",
            "dropped"
          ]
        }
      }
    }
  }
}
